"targets","layer","name","description","citation","units","filename","fld_value","fld_id_num","fld_id_chr","fld_category","fld_year","fld_val_num","fld_val_chr","file_exists","val_min","val_max","val_0to1","flds_unused","flds_missing","rows_duplicated","num_ids_unique"
"spatial","rtk_rgn_labels","regions by type (eez, subocean, unclaimed) and label","regions by type (eez, subocean, unclaimed) and label","","label","rgn_labels.csv","label","rgn_id",,"type",,,"label",TRUE,,,,,,,220
"SPP","rn_spp_status","Species lists and IUCN threat categories as a proxy for iconic species status","International Union for Conservation of Nature (IUCN) Red List threat categories with aggregated species lists ","5.29","status score","rgn_spp_score_2012.csv","score","rgn_id",,,,"score",,TRUE,0.743259450182977,0.930308754120408,TRUE,,,,220
"SPP","rn_spp_trend","Species lists and IUCN threat categories as a proxy for iconic species trend","International Union for Conservation of Nature (IUCN) Red List threat categories with aggregated species lists ","5.29","trend score","rgn_spp_trend_2012.csv","score","rgn_id",,,,"score",,TRUE,-0.464904077028102,0.0977703458133595,FALSE,,,,220
"TR","tr_jobs_tourism","Direct employment in tourism","","","jobs","rgn_wttc_empd_2013a_avgduplicates.csv","count","rgn_id",,,"year","count",,TRUE,-5600,25750300,FALSE,,,,220
"TR","tr_jobs_total","Total labor force","","","jobs","rgn_wb_lab_2013a_avgduplicates.csv","count","rgn_id",,,"year","count",,TRUE,32114.39244,481718093.2,FALSE,,,,220
"TR","tr_unemployment","Percent unemployment","","","percent unemployed","rgn_wb_uem_2013a_avgduplicates.csv","percent","rgn_id",,,"year","percent",,TRUE,-7.79999923999912,59.5,FALSE,,,,220
"TR","tr_sustainability","Sustainability index","Tourism Competitiveness Index (TTCI) from the World Economic Forum","","score","rgn_wef_ttci_2013a_lyr.csv","score","rgn_id",,,,"score",,TRUE,2.59,5.39,FALSE,,,,220
